{
  "approval_required": true,
  "candidates": [
    {
      "candidate_id": "single-rigid",
      "hard_failures": [
        "segment 9 is not horizontal, vertical or 45-degree",
        "segment 10 is not horizontal, vertical or 45-degree",
        "segment 126 is not horizontal, vertical or 45-degree",
        "segment 127 is not horizontal, vertical or 45-degree",
        "segment 133 is not horizontal, vertical or 45-degree",
        "segment 137 is not horizontal, vertical or 45-degree",
        "segment 201 is not horizontal, vertical or 45-degree",
        "segment 218 is not horizontal, vertical or 45-degree",
        "segment 237 is not horizontal, vertical or 45-degree",
        "segment 581 is not horizontal, vertical or 45-degree",
        "segment 585 is not horizontal, vertical or 45-degree",
        "segment 590 is not horizontal, vertical or 45-degree",
        "segment 599 is not horizontal, vertical or 45-degree",
        "segment 603 is not horizontal, vertical or 45-degree",
        "segment 608 is not horizontal, vertical or 45-degree",
        "segment 617 is not horizontal, vertical or 45-degree",
        "segment 621 is not horizontal, vertical or 45-degree",
        "segment 626 is not horizontal, vertical or 45-degree",
        "segment 666 is not horizontal, vertical or 45-degree",
        "segment 794 is not horizontal, vertical or 45-degree",
        "high-speed net 10 contains 1 right-angle corner(s)"
      ],
      "incomplete_analyses": [
        "thermal",
        "structural",
        "signal_integrity",
        "manufacturing_cost"
      ],
      "interconnects": [],
      "islands": [
        {
          "component_ids": [
            "C1",
            "C10",
            "C11",
            "C12",
            "C13",
            "C14",
            "C15",
            "C16",
            "C17",
            "C18",
            "C19",
            "C2",
            "C20",
            "C21",
            "C22",
            "C23",
            "C24",
            "C25",
            "C26",
            "C27",
            "C28",
            "C29",
            "C3",
            "C30",
            "C31",
            "C32",
            "C33",
            "C34",
            "C35",
            "C36",
            "C37",
            "C4",
            "C5",
            "C6",
            "C7",
            "C8",
            "C9",
            "D1",
            "D10",
            "D11",
            "D12",
            "D13",
            "D2",
            "D3",
            "D4",
            "D5",
            "D6",
            "D7",
            "D8",
            "D9",
            "ENC1",
            "J1",
            "J2",
            "J3",
            "JS1",
            "L1",
            "L2",
            "LED1",
            "LED10",
            "LED11",
            "LED12",
            "LED13",
            "LED2",
            "LED3",
            "LED4",
            "LED5",
            "LED6",
            "LED7",
            "LED8",
            "LED9",
            "R1",
            "R10",
            "R11",
            "R12",
            "R13",
            "R14",
            "R15",
            "R16",
            "R17",
            "R2",
            "R3",
            "R4",
            "R5",
            "R6",
            "R7",
            "R8",
            "R9",
            "SW1",
            "SW10",
            "SW11",
            "SW12",
            "SW13",
            "SW2",
            "SW3",
            "SW4",
            "SW5",
            "SW6",
            "SW7",
            "SW8",
            "SW9",
            "U1",
            "U2",
            "U3",
            "U4",
            "U5",
            "U6",
            "U7"
          ],
          "island_id": "single-rigid-island-1",
          "kind": "rigid"
        }
      ],
      "metrics": {
        "interconnect_count": {
          "method": "cross-island net count",
          "status": "pass",
          "unit": "count",
          "value": 0.0,
          "weight": 3.0
        },
        "interconnect_evidence": {
          "method": "single-board candidate has no cross-island interconnect",
          "status": "not_applicable",
          "unit": "status",
          "value": null,
          "weight": 4.0
        },
        "island_count": {
          "method": "deterministic functional partition",
          "status": "pass",
          "unit": "count",
          "value": 1.0,
          "weight": 1.0
        },
        "manufacturing_cost": {
          "method": "manufacturer quote required",
          "status": "incomplete",
          "unit": "currency",
          "value": null,
          "weight": 2.0
        },
        "octilinear_route_compliance": {
          "method": "measured 0/45/90-degree copper segments",
          "status": "fail",
          "unit": "ratio",
          "value": null,
          "weight": 4.0
        },
        "signal_integrity": {
          "method": "routed stackup simulation required",
          "status": "incomplete",
          "unit": "score",
          "value": null,
          "weight": 4.0
        },
        "structural": {
          "method": "exact structural solver required",
          "status": "incomplete",
          "unit": "score",
          "value": null,
          "weight": 3.0
        },
        "thermal": {
          "method": "exact thermal solver required",
          "status": "incomplete",
          "unit": "score",
          "value": null,
          "weight": 3.0
        },
        "weighted_connection_length_mm": {
          "method": "measured routed copper",
          "status": "pass",
          "unit": "mm",
          "value": 5138.849373379865,
          "weight": 4.0
        }
      },
      "rank": null,
      "rationale": [
        "one rigid board avoids unnecessary interconnect reliability penalties"
      ],
      "score": null,
      "status": "rejected",
      "topology": "single_rigid"
    },
    {
      "candidate_id": "rigid-flex",
      "hard_failures": [],
      "incomplete_analyses": [
        "weighted_connection_length_mm",
        "octilinear_route_compliance",
        "thermal",
        "structural",
        "signal_integrity",
        "manufacturing_cost",
        "interconnect_evidence"
      ],
      "interconnects": [
        {
          "connector_pin_map": [],
          "endpoint_component_ids": [
            "C1",
            "C10",
            "C11",
            "C12",
            "C13",
            "C14",
            "C15",
            "C16",
            "C17",
            "C18",
            "C19",
            "C2",
            "C20",
            "C21",
            "C22",
            "C23",
            "C24",
            "C25",
            "C26",
            "C27",
            "C28",
            "C29",
            "C3",
            "C30",
            "C31",
            "C32",
            "C33",
            "C34",
            "C35",
            "C36",
            "C37",
            "C4",
            "C5",
            "C6",
            "C7",
            "C8",
            "C9",
            "ENC1",
            "J1",
            "J2",
            "JS1",
            "LED1",
            "LED10",
            "LED11",
            "LED12",
            "LED13",
            "LED2",
            "LED3",
            "LED4",
            "LED5",
            "LED6",
            "LED7",
            "LED8",
            "LED9",
            "R1",
            "R12",
            "R2",
            "R3",
            "R4",
            "R5",
            "U1",
            "U2",
            "U3",
            "U4",
            "U5",
            "U6",
            "U7"
          ],
          "estimated_length_mm": null,
          "estimated_voltage_drop_v": null,
          "evidence_digest": null,
          "evidence_status": "incomplete",
          "interconnect_id": "link-0",
          "island_ids": [
            "rigid-flex-island-1",
            "rigid-flex-island-3",
            "rigid-flex-island-4",
            "rigid-flex-island-5",
            "rigid-flex-island-6",
            "rigid-flex-island-7",
            "rigid-flex-island-8"
          ],
          "kind": "flex",
          "maximum_length_mm": null,
          "minimum_bend_radius_mm": null,
          "net_id": "0"
        },
        {
          "connector_pin_map": [],
          "endpoint_component_ids": [
            "C32",
            "C4",
            "C5",
            "J3",
            "JS1",
            "R10",
            "R14",
            "R15",
            "R16",
            "R17",
            "R6",
            "R7",
            "R8",
            "R9",
            "U1",
            "U3",
            "U4"
          ],
          "estimated_length_mm": null,
          "estimated_voltage_drop_v": null,
          "evidence_digest": null,
          "evidence_status": "incomplete",
          "interconnect_id": "link-1",
          "island_ids": [
            "rigid-flex-island-1",
            "rigid-flex-island-5",
            "rigid-flex-island-6",
            "rigid-flex-island-7"
          ],
          "kind": "flex",
          "maximum_length_mm": null,
          "minimum_bend_radius_mm": null,
          "net_id": "1"
        },
        {
          "connector_pin_map": [],
          "endpoint_component_ids": [
            "J1",
            "U1",
            "U2"
          ],
          "estimated_length_mm": null,
          "estimated_voltage_drop_v": null,
          "evidence_digest": null,
          "evidence_status": "incomplete",
          "interconnect_id": "link-10",
          "island_ids": [
            "rigid-flex-island-7",
            "rigid-flex-island-8"
          ],
          "kind": "flex",
          "maximum_length_mm": null,
          "minimum_bend_radius_mm": null,
          "net_id": "10"
        },
        {
          "connector_pin_map": [],
          "endpoint_component_ids": [
            "J1",
            "U1",
            "U2"
          ],
          "estimated_length_mm": null,